<?xml version="1.0" encoding="UTF-8"?>
<!--                                                         -->
<!-- Energistics License Agreement
This file is distributed under the Energistics License Agreement at
http://www.energistics.org
Use of this file constitutes agreement with the Energistics License Agreement.
Copyright (c) 2012 Energistics. All rights reserved.
Energistics, WITSML, PRODML and RESQML are trademarks or registered trademarks of Energistics.
-->
<witsml:equipmentPropertySet xsi:schemaLocation="http://www.witsml.org/schemas/1series cs_xmlEquipmentProperties.xsd" xmlns:xsi="http://www.w3.org/2001/XMLSchema-instance" xmlns:witsml="http://www.witsml.org/schemas/1series">
	<witsml:equipmentProperties>
		<witsml:equipment>Casing Crossover</witsml:equipment>
		<witsml:property name="torqueMaxTorque">
			<witsml:type>momentOfForceMeasure</witsml:type>
			<witsml:isOptional>true</witsml:isOptional>
		</witsml:property>
		<witsml:property name="torqueMakeupTorque">
			<witsml:type>momentOfForceMeasure</witsml:type>
			<witsml:isOptional>true</witsml:isOptional>
		</witsml:property>
	</witsml:equipmentProperties>
	<witsml:equipmentProperties>
		<witsml:equipment>Casing Head</witsml:equipment>
		<witsml:property name="presRatingTopConnection">
			<witsml:type>pressureMeasure</witsml:type>
			<witsml:isOptional>true</witsml:isOptional>
		</witsml:property>
		<witsml:property name="presRatingBottomConnection">
			<witsml:type>pressureMeasure</witsml:type>
			<witsml:isOptional>true</witsml:isOptional>
		</witsml:property>
		<witsml:property name="diaValveBore_1">
			<witsml:type>lengthMeasure</witsml:type>
			<witsml:isOptional>true</witsml:isOptional>
		</witsml:property>
		<witsml:property name="diaValveBore_2">
			<witsml:type>lengthMeasure</witsml:type>
			<witsml:isOptional>true</witsml:isOptional>
		</witsml:property>
		<witsml:property name="presMaxPres">
			<witsml:type>pressureMeasure</witsml:type>
			<witsml:isOptional>true</witsml:isOptional>
		</witsml:property>
		<witsml:property name="presWorkingPressure">
			<witsml:type>pressureMeasure</witsml:type>
			<witsml:isOptional>true</witsml:isOptional>
		</witsml:property>
		<witsml:property name="namePackoffType">
			<witsml:type>nameString</witsml:type>
			<witsml:isOptional>true</witsml:isOptional>
		</witsml:property>
		<witsml:property name="nameBottomRingGasket">
			<witsml:type>nameString</witsml:type>
			<witsml:isOptional>true</witsml:isOptional>
		</witsml:property>
		<witsml:property name="nameTopRingGasket">
			<witsml:type>nameString</witsml:type>
			<witsml:isOptional>true</witsml:isOptional>
		</witsml:property>
		<witsml:property name="nameSection">
			<witsml:type>nameString</witsml:type>
			<witsml:isOptional>true</witsml:isOptional>
		</witsml:property>
		<witsml:property name="nameOutletLocation">
			<witsml:type>nameString</witsml:type>
			<witsml:isOptional>true</witsml:isOptional>
		</witsml:property>
		<witsml:property name="presOutletMaxPressure">
			<witsml:type>pressureMeasure</witsml:type>
			<witsml:isOptional>true</witsml:isOptional>
		</witsml:property>
		<witsml:property name="nameOutletRingGasket">
			<witsml:type>nameString</witsml:type>
			<witsml:isOptional>true</witsml:isOptional>
		</witsml:property>
		<witsml:property name="presOutletWorkingPressure">
			<witsml:type>pressureMeasure</witsml:type>
			<witsml:isOptional>true</witsml:isOptional>
		</witsml:property>
		<witsml:property name="isValveBullPlug">
			<witsml:type>logicalBoolean</witsml:type>
			<witsml:isOptional>true</witsml:isOptional>
		</witsml:property>
		<witsml:property name="isValveCompanionFlange">
			<witsml:type>logicalBoolean</witsml:type>
			<witsml:isOptional>true</witsml:isOptional>
		</witsml:property>
		<witsml:property name="nameValveMake">
			<witsml:type>nameString</witsml:type>
			<witsml:isOptional>true</witsml:isOptional>
		</witsml:property>
		<witsml:property name="nameValveModel">
			<witsml:type>nameString</witsml:type>
			<witsml:isOptional>true</witsml:isOptional>
		</witsml:property>
		<witsml:property name="nameValveSN">
			<witsml:type>nameString</witsml:type>
			<witsml:isOptional>true</witsml:isOptional>
		</witsml:property>
		<witsml:property name="dTimeLastOverhaulDate">
			<witsml:type>timestamp</witsml:type>
			<witsml:isOptional>true</witsml:isOptional>
		</witsml:property>
		<witsml:property name="presValveWorkingPressure">
			<witsml:type>pressureMeasure</witsml:type>
			<witsml:isOptional>true</witsml:isOptional>
		</witsml:property>
		<witsml:property name="typeValve_1">
			<witsml:type>nameString</witsml:type>
			<witsml:isOptional>true</witsml:isOptional>
		</witsml:property>
		<witsml:property name="typeValve_2">
			<witsml:type>nameString</witsml:type>
			<witsml:isOptional>true</witsml:isOptional>
		</witsml:property>
	</witsml:equipmentProperties>
	<witsml:equipmentProperties>
		<witsml:equipment>Casing Shoe</witsml:equipment>
		<witsml:property name="typeShoe">
			<witsml:type>nameString</witsml:type>
			<witsml:isOptional>true</witsml:isOptional>
		</witsml:property>
		<witsml:property name="torqueMaxTorque">
			<witsml:type>momentOfForceMeasure</witsml:type>
			<witsml:isOptional>true</witsml:isOptional>
		</witsml:property>
		<witsml:property name="torqueMakeupTorque">
			<witsml:type>momentOfForceMeasure</witsml:type>
			<witsml:isOptional>true</witsml:isOptional>
		</witsml:property>
	</witsml:equipmentProperties>
	<witsml:equipmentProperties>
		<witsml:equipment>Casing Spool</witsml:equipment>
		<witsml:property name="presRatingTopConnection">
			<witsml:type>pressureMeasure</witsml:type>
			<witsml:isOptional>true</witsml:isOptional>
		</witsml:property>
		<witsml:property name="presRatingBottomConnection">
			<witsml:type>pressureMeasure</witsml:type>
			<witsml:isOptional>true</witsml:isOptional>
		</witsml:property>
		<witsml:property name="diaValveBore_1">
			<witsml:type>lengthMeasure</witsml:type>
			<witsml:isOptional>true</witsml:isOptional>
		</witsml:property>
		<witsml:property name="diaValveBore_2">
			<witsml:type>lengthMeasure</witsml:type>
			<witsml:isOptional>true</witsml:isOptional>
		</witsml:property>
		<witsml:property name="presMaxPres">
			<witsml:type>pressureMeasure</witsml:type>
			<witsml:isOptional>true</witsml:isOptional>
		</witsml:property>
		<witsml:property name="isProposedWellhead">
			<witsml:type>logicalBoolean</witsml:type>
			<witsml:isOptional>true</witsml:isOptional>
		</witsml:property>
		<witsml:property name="presWorkingPressure">
			<witsml:type>pressureMeasure</witsml:type>
			<witsml:isOptional>true</witsml:isOptional>
		</witsml:property>
		<witsml:property name="namePackoffType">
			<witsml:type>nameString</witsml:type>
			<witsml:isOptional>true</witsml:isOptional>
		</witsml:property>
		<witsml:property name="nameBottomRingGasket">
			<witsml:type>nameString</witsml:type>
			<witsml:isOptional>true</witsml:isOptional>
		</witsml:property>
		<witsml:property name="nameTopRingGasket">
			<witsml:type>nameString</witsml:type>
			<witsml:isOptional>true</witsml:isOptional>
		</witsml:property>
		<witsml:property name="nameSection">
			<witsml:type>nameString</witsml:type>
			<witsml:isOptional>true</witsml:isOptional>
		</witsml:property>
		<witsml:property name="nameOutletLocation">
			<witsml:type>nameString</witsml:type>
			<witsml:isOptional>true</witsml:isOptional>
		</witsml:property>
		<witsml:property name="presOutletMaxPressure">
			<witsml:type>pressureMeasure</witsml:type>
			<witsml:isOptional>true</witsml:isOptional>
		</witsml:property>
		<witsml:property name="nameOutletRingGasket">
			<witsml:type>nameString</witsml:type>
			<witsml:isOptional>true</witsml:isOptional>
		</witsml:property>
		<witsml:property name="presOutletWorkingPressure">
			<witsml:type>pressureMeasure</witsml:type>
			<witsml:isOptional>true</witsml:isOptional>
		</witsml:property>
		<witsml:property name="isValveBullPlug">
			<witsml:type>logicalBoolean</witsml:type>
			<witsml:isOptional>true</witsml:isOptional>
		</witsml:property>
		<witsml:property name="isValveCompanionFlange">
			<witsml:type>logicalBoolean</witsml:type>
			<witsml:isOptional>true</witsml:isOptional>
		</witsml:property>
		<witsml:property name="nameValveMake">
			<witsml:type>nameString</witsml:type>
			<witsml:isOptional>true</witsml:isOptional>
		</witsml:property>
		<witsml:property name="nameValveModel">
			<witsml:type>nameString</witsml:type>
			<witsml:isOptional>true</witsml:isOptional>
		</witsml:property>
		<witsml:property name="nameValveSN">
			<witsml:type>nameString</witsml:type>
			<witsml:isOptional>true</witsml:isOptional>
		</witsml:property>
		<witsml:property name="presValveWorkingPressure">
			<witsml:type>pressureMeasure</witsml:type>
			<witsml:isOptional>true</witsml:isOptional>
		</witsml:property>
		<witsml:property name="dTimeLastOverhaulDate">
			<witsml:type>timestamp</witsml:type>
			<witsml:isOptional>true</witsml:isOptional>
		</witsml:property>
		<witsml:property name="valveType1">
			<witsml:type>nameString</witsml:type>
			<witsml:isOptional>true</witsml:isOptional>
		</witsml:property>
		<witsml:property name="valveType2">
			<witsml:type>nameString</witsml:type>
			<witsml:isOptional>true</witsml:isOptional>
		</witsml:property>
	</witsml:equipmentProperties>
	<witsml:equipmentProperties>
		<witsml:equipment>Casing/Casing Liner</witsml:equipment>
		<witsml:property name="blankBottomLength">
			<witsml:type>lengthMeasure</witsml:type>
			<witsml:isOptional>true</witsml:isOptional>
		</witsml:property>
		<witsml:property name="blankTopLength">
			<witsml:type>lengthMeasure</witsml:type>
			<witsml:isOptional>true</witsml:isOptional>
		</witsml:property>
		<witsml:property name="perforationMaxDimension">
			<witsml:type>lengthMeasure</witsml:type>
			<witsml:isOptional>true</witsml:isOptional>
		</witsml:property>
		<witsml:property name="perforationMinDimension">
			<witsml:type>lengthMeasure</witsml:type>
			<witsml:isOptional>true</witsml:isOptional>